|Jargon Term|Annotation|Start Pos|End Pos
0|fluid collections in your abdomen and chest| Medical Issues - Symptom|65|108
1|You will be on antibiotics possibly until tht drain is removed| Treatments - Medicine name|227|290
2|You need to continue to increase your activity, stay well hydrated and eat well so that you will be able to get home soon| Aftercare instructions - patient needs to do - Other|378|499
3|In the interim we are sending you for short term rehab to improve your strength and endurance| Aftercare instructions - patient needs to do - Other|501|594
4|shortness of breath| Medical Issues - Symptom|616|635
5|fevers| Medical Issues - Symptom|637|643
